Baltona,Baltona,Cold,,510,retail,bartosz.kosiba@kreativia.pl,http://www.baltona.pl,http://www.linkedin.com/company/baltona-sa,,,49 ulica Komitetu Obrony Robotnikow,Warszawa,woj. mazowieckie,Poland,02-146,"49 ulica Komitetu Obrony Robotnikow, Warszawa, woj. mazowieckie, Poland, 02-146","ship supply logistics, duty free products, airport stores, duty free promotional campaigns, travel exclusive products, customer engagement, airport shopping, retail network, travel retail customer experience, alcohol sales, airport logistics, brand partnerships, airport store design, retail management, confectionery, perfumes, retail expansion, duty free product sourcing, airport retail compliance, b2c, travel retail marketing, transportation & logistics, food and beverage, consumer goods, distribution, food & beverage, duty free exclusives, airport retail technology, cosmetics, duty free sales, services, international brands, food service, retail stores, airport retail, tobacco products, travel retail, duty free, ship chandlery, online shopping, duty free promotions, duty free brand collaborations, ship supply, retail, airport convenience, travel accessories, duty free packaging, consumer products & retail, food & beverages, consumers, beauty, apparel & fashion, e-commerce, consumer internet, internet, information technology & services",+48 22 519 20 00,"Outlook, WordPress.org, Mobile Friendly, reCAPTCHA, Google Tag Manager, Google Analytics, Apache, Google Font API, Render",,,,,,,685e806c6341040021f69582,5999,,"Baltona is a Poland-based company founded in 1946, specializing in duty-free retail and supply services for the maritime and aviation industries. Headquartered in Warsaw, it operates a network of duty-free stores in Poland and internationally, including locations in France, Romania, and Ukraine, with a significant presence at airports like Warsaw Chopin Airport.

The company offers a diverse range of products through its retail division, including luxury goods, clothing, food, beverages, and confectionery. Baltona also manages restaurants and coffee shops, focusing on convenience and quality. In addition to retail, it provides maritime supply services to various vessels and aviation supply services to airlines, including Polish Airlines (LOT). With over 500 employees, Baltona is committed to high standards and customer satisfaction, aiming to be a leading partner in the duty-free and travel retail sectors.",1946,https://zenprospect-production.s3.amazonaws.com/uploads/pictures/691711a37907f0000106caa8/picture,,,,,,,,
CCC Group,CCC Group,Cold,,2500,retail,bartosz.kosiba@kreativia.pl,http://www.ccc.eu,http://www.linkedin.com/company/ccc_group,https://facebook.com/ccc.poland,,6 ulica Strefowa,,Lower Silesian Voivodeship,Poland,59-100,"6 ulica Strefowa, Lower Silesian Voivodeship, Poland, 59-100","sales, footwear, production, distribution, designing, fashion, ecommerce, logistics, multi-channel sales, retail technology, retail, brand management, customer service, retail network, payment options, retail logistics, retail automation, retail customer loyalty, inventory management, market penetration, transportation & logistics, omnichannel retail, e-commerce platform, b2c, multi-brand retailing, clothing, clothing and footwear retail, market presence, retail innovation, retail growth, customer experience, brand diversification, omnichannel platform, retail analytics, omnichannel, accessories, retail services, social media, digital sales channels, apparel, customer engagement, e-commerce, digital payments, clothing retail, digital integration, online retail, retail supply chain, online shopping, offline retail, services, consumer goods retail, footwear retail, mobile app, retail expansion, brand portfolio, retail marketing, market strategy, delivery services, market expansion, bags, free shipping, return policy, men's shoes, women's shoes, children's shoes, sneakers, boots, heels, sandals, moccasins, canvas shoes, dress shoes, sport shoes, fashion blog, brand collaborations, discounts, promotions, eco-friendly products, size guide, order tracking, customer support, store locator, popular brands, adidas, nike, reebok, puma, lasocki, gino rossi, badura, jenny fairy, deezee, black week, fashion categories, travel bags, backpacks, credit card payment, pay on delivery, in-store pickup, influencers, gift cards, 3d fitting, shoe care products, consumer products & retail, shoes, consumer goods, consumers, apparel & fashion, consumer internet, internet, information technology & services, enterprise software, enterprises, computer software, b2b",+380 322 470 106,"Cloudflare DNS, Outlook, CloudFlare Hosting, New Relic, DoubleClick Floodlight, WordPress.org, Google AdSense, 33Across, Google Tag Manager, Paczkomaty, DoubleClick, Google AdWords Conversion, Rubicon Project, Bing Ads, Google Analytics, Google Maps, Cedexis Radar, OpenX - Exchange, Facebook Widget, Google Dynamic Remarketing, Facebook Custom Audiences, Hotjar, reCAPTCHA, RTB House, TripleLift, YouTube, DoubleClick Conversion, Affiliate Window, Bootstrap Framework, Teads, AppNexus, Google Font API, Adobe Media Optimizer, Google Maps (Non Paid Users), Mobile Friendly, Vimeo, Adform, Facebook Login (Connect), Linkedin Widget",,,,,203000000,,685e82f0f855e400197ada51,5999,,"The CCC Group is a prominent European company specializing in the retail and distribution of footwear and fashion products. Founded in the early 1990s from the Miłek Trading Company, it has established itself as a leading footwear retailer in Central and Eastern Europe. The company is headquartered in Poland and operates through subsidiaries in countries such as Croatia, Hungary, Slovakia, and the Czech Republic.

CCC Group manages a large sales network and offers a diverse range of shoes and fashion accessories aimed at various customer segments. It has achieved significant milestones, including surpassing 1 billion PLN in sales revenue. The company also operates a modern logistics center in Poland, featuring a fully automated high-bay warehouse, which is the largest of its kind in Central Europe. Through its tailored approach to local markets, CCC Group continues to expand its presence in the region.",1999,https://zenprospect-production.s3.amazonaws.com/uploads/pictures/690cd3768f35c00001db0dfd/picture,,,,,,,,
Storefix,Storefix,Cold,,1,retail,bartosz.kosiba@kreativia.pl,http://www.storefix.cl,http://www.linkedin.com/company/storefixpl,,,12 ulica Wojciecha Zywnego,Warszawa,woj. mazowieckie,Poland,02-701,"12 ulica Wojciecha Zywnego, Warszawa, woj. mazowieckie, Poland, 02-701","shopfitting & retail shelving, retail office equipment",,"reCAPTCHA, Apache, Mobile Friendly, WordPress.org",,,,,,,6867b8605347ce0001b3915e,,,"We are a privately-owned company headquartered in Warsaw, Poland which draws on more than 30 years of experience in providing retailers, distributors, architects, design studios and shopfitting companies with the equipment they need to fit out their stores.

We are committed to supplying our customers with the best products at the most competitive prices. Our product range extends from 50 and 25 mm standard shelving systems to bespoke solutions, individually developed on request.

Our range of products is complimented by second to none, personalized services,
from design & development, prototyping, to delivery and installations. Our service makes the difference.

We are a flexible partner for all your shelving needs and we offer industry-leading service levels. Short lead times and competitive prices are our trademarks.

We offer the most common European 50 mm shelving system,
well known for its durability and compatibility with other shelving systems.

We combine low-cost production in the Far East with local, central European manufacturing, ensuring full compatibility between both options. Local manufacturing facilities cover the short lead time requirements and offer a wide variety of colors while maintaining very competitive pricing.

In addition, we offer a 25 mm system that caters for the needs of those,
who require a more refined shelf height adjustment.

On top of the standard, modular shelving systems, we also offer an unlimited range of bespoke, tailor-made accessories. The sky is the limit and your needs are our goalpost.

We can provide you with everything you need to compliment your store design.",,https://zenprospect-production.s3.amazonaws.com/uploads/pictures/690447c6c8e2e20001350c7f/picture,,,,,,,,
Trygon Sport,Trygon Sport,Cold,,1,retail,bartosz.kosiba@kreativia.pl,http://www.trygonsport.pl,http://www.linkedin.com/company/trygon-sport,https://www.facebook.com/TrygonSportpl/,,,Zielona Gora,Lubusz Voivodeship,Poland,,"Zielona Gora, Lubusz Voivodeship, Poland",,,"Nginx, Google Font API, Facebook Custom Audiences, Paczkomaty, Google Tag Manager, Mobile Friendly",,,,,,,6868f0c9f7992c0001b00c37,,,"Sklep sportowy TrygonSport.pl - sport & street (sklep odzieżowy). Trygon Sport oferuje markowe buty i odzież. Najlepsze marki, tylko oryginalne produkty. Kolekcje sports i streetwear.",,https://zenprospect-production.s3.amazonaws.com/uploads/pictures/63edac0a998f12000100b12d/picture,,,,,,,,
Rossmann Polska,Rossmann Polska,Cold,,20000,retail,bartosz.kosiba@kreativia.pl,http://www.rossmann.pl,http://www.linkedin.com/company/rossmann,https://www.facebook.com/RossmannPL,,,Lodz,Lodz Voivodeship,Poland,91-222,"Lodz, Lodz Voivodeship, Poland, 91-222","retail & drugstores, retail supply chain efficiency, private label product development, private label development, cost reduction, market penetration strategies, retail logistics management, value retail, logistics solutions, sustainability, private label product innovation, brand development, grocery and convenience retailers, food, personal care, private label brands, retail analytics, market expansion strategies, european retail chain, grocery items, family-led retail business, haircare products, retail operations, b2c, retail logistics innovation, discount health and beauty, european retail, environmental responsibility, accessible retail, retail expansion, anti-aging, market strategy, perfumes, household products, household goods, hair care, retail sustainability initiatives, market growth in poland, distribution, drugstore chain, product range, efficiency, supply chain logistics, customer service, retail expansion in central europe, sustainability practices, self-care, value for money, product innovation, customer engagement, skincare, market growth, mobile app, e-commerce, retail logistics, wellness, brand reputation, family business succession, retail branding, retail store network, supply chain optimization, online shopping, consumer goods, logistics, health and beauty, private label marketing, family business, distribution network, retail operational excellence, lifestyle, affordable products, customer loyalty programs, quality products, pets, inventory management, supply chain management, health, fragrances, store network, pharmacy, pet food, supply chain, retail sustainability, makeup, brand recognition, customer loyalty, beauty products, retail technology, retail environmental initiatives, discount retail, cosmetics, retail logistics solutions, retail marketing, operational efficiency, private labels, healthcare, customer base, retail logistics optimization, user experience, market expansion, cosmetics and skincare, digital transformation, private label branding, market presence, retail, hygiene, men's grooming, baby care, home products, discounts, subscriptions, promotions, free delivery, returns, order history, payment methods, body care, shower gels, bath products, deodorants, facial care, sunscreen, natural products, gift sets, seasonal collections, highlighters, foundations, concealers, cleansers, serums, body scrubs, moisturizers, shampoos, conditioners, baby nutrition, household essentials, pantry items, online exclusive, loyalty programs, membership, gift vouchers, consumer products & retail, transportation & logistics, environmental services, renewables & environment, consumers, consumer internet, internet, information technology & services, logistics & supply chain, enterprise software, enterprises, computer software, b2b, beauty, apparel & fashion, health care, health, wellness & fitness, hospital & health care, ux",+48 42 613 91 00,"Cloudflare DNS, Outlook, Microsoft Office 365, CloudFlare Hosting, YouTube, Google Play, reCAPTCHA, Typekit, DoubleClick, Google Font API, Google Places, Facebook Login (Connect), Bootstrap Framework, Criteo, WordPress.org, Adobe Media Optimizer, Google Maps, Bing Ads, Google Analytics, DoubleClick Conversion, DoubleClick Floodlight, Google Tag Manager, Google Dynamic Remarketing, Facebook Custom Audiences, Paczkomaty, Mobile Friendly, Facebook Widget, Vimeo, Cedexis Radar",,,,,3398000000,,6868f0c9f7992c0001b00bf6,5331,4451,"Rossmann Polska is the Polish branch of Rossmann, a major drugstore chain in Europe, founded in 1972 in Germany. Established in 1993, Rossmann Polska has grown to operate over 1,000 stores across approximately 400 cities in Poland. The company is known for its wide selection of health, beauty, and personal care products, including popular brands and its own private label offerings.

The company emphasizes quality, affordability, and accessibility, catering to a diverse customer base that values these attributes. Rossmann Polska employs a sophisticated logistics system, with a main warehouse in Łódź that supports its extensive retail network. This efficient supply chain is enhanced by advanced technologies, ensuring that stores are well-stocked and able to meet customer needs.

With a strong commitment to customer experience, Rossmann Polska aims to build trust in its brand through well-trained staff and modern retail environments. The company continues to thrive as a key player in the Polish drugstore market, rooted in a legacy of innovation and quality.",1993,https://zenprospect-production.s3.amazonaws.com/uploads/pictures/69141fb19358ab0001d5d961/picture,,,,,,,,
home&you S.A.,home&you S.A,Cold,,240,retail,bartosz.kosiba@kreativia.pl,http://www.home-you.com,http://www.linkedin.com/company/home-you,https://www.facebook.com/homeandyouofficial,http://twitter.com/teamhomeyou,224 ulica Juliusza Slowackiego,Gdansk,pomorskie,Poland,80-298,"224 ulica Juliusza Slowackiego, Gdansk, pomorskie, Poland, 80-298","home, you, essex, homedecor, home & garden, home renovation, interior design & construction, home improvement, home accessories online, decorative items, home accessories promotion, retail, kitchenware, seasonal decorations, seasonal interior trends, textile manufacturing, b2c, home decor promotion, home textiles sale, home accessories discount, wall art, interior design, flooring, interior decoration, home styling tips, home lighting, window decorations, seasonal home collections, home improvement products, home decor inspiration, home textiles for bathroom, home decor, interior styling accessories, home textiles for kitchen, furniture accessories, online shopping, e-commerce, d2c, artificial plants, home decoration ideas, furniture, home textiles for bedroom, home textiles online, home organization, home textiles, home styling, textiles, home textiles for dining, home accessories, seasonal collections, home decor accessories, consumer internet, consumers, internet, information technology & services, home services, masonry/concrete",+48 58 762 20 20,"Akamai DNS, Outlook, Microsoft Office 365, Taboola Newsroom, TripleLift, Magento, Atlas by Facebook, 33Across, New Relic, AppNexus, Google Font API, Google Tag Manager, Paczkomaty, Rubicon Project, RTB House, Hotjar, Google Places, DoubleClick, Bing Ads, WordPress.org, SOASTA, DoubleClick Conversion, Facebook Widget, SALESmanago, iGoDigital, DoubleClick Floodlight, Tradedoubler, Google Dynamic Remarketing, Facebook Login (Connect), Criteo, Google Maps, Google AdWords Conversion, Mobile Friendly, Adform, Facebook Custom Audiences",,,,,,1,6868f0c9f7992c0001b00c56,5712,,"home&you S.A. is a leading Polish company that specializes in home furnishings and interior decoration products. Founded in 2001 and based in Gdańsk, Poland, the company operates in the retail trade sector, offering a diverse range of items including textiles, kitchenware, furniture, lighting, tableware, decorative items, garden furniture, children's products, and pet accessories. 

With over 130 physical stores across Poland and a robust online marketplace launched in 2013, home&you provides customers with a convenient shopping experience. The online platform allows multiple vendors to showcase their products, enhancing the variety available to consumers. As part of the BBK S.A. group, home&you benefits from over 25 years of experience in the interior decoration industry, which supports its market presence and growth. The company focuses on homeowners and individuals looking for stylish and functional home decor solutions.",1995,https://zenprospect-production.s3.amazonaws.com/uploads/pictures/69117bfeb45f350001141d5f/picture,,,,,,,,
Plasticdisplay,Plasticdisplay,Cold,"lista firm jak Vivenge PL, lista firm Expo PL bez MTP, Firmy EXPO PL - 6.11.25",9,retail,bartosz.kosiba@kreativia.pl,http://www.plasticdisplay.com.pl,http://www.linkedin.com/company/plastic-display,,,5 Skarszewska,Tczew,pomorskie,Poland,83-110,"5 Skarszewska, Tczew, pomorskie, Poland, 83-110","retail services, retail office equipment, custom store furniture, innovative store solutions, retail project management, advanced manufacturing technologies, visual merchandising, retail, store furniture, laser cutting, project consulting, store fixtures, distribution, retail store equipment, innovative solutions, eco-friendly materials, retail chain projects, alcohol showcases, promotional stands, store fixtures for food and non-food, display systems, store design, retail industry expertise, sustainable production, cigarette dispensers, b2b, fruit and vegetable displays, project management, manufacturing, steel processing, display solutions, bakery stands, custom retail furniture, retail trade, retail branding, hygiene standards, high-quality materials, retail visual merchandising, store installation services, consulting, store project consulting, sporting and athletic goods manufacturing, services, logistics and assembly, customer experience enhancement, retail sales promotion, retail logistics, environmentally friendly practices, store layout design, custom display systems, productivity, mechanical or industrial engineering",+48 58 511 03 37,,,,,,,,687582df8ab78f00017cc9c2,3599,33992,"Założona w 1992 r. firma Plasticdisplay to liczący się producent mebli sklepowych i elementów wspierających sprzedaż. Jesteśmy firmą rodzinną z ponad 25 letnim doświadczeniem w branży.

25 lat doświadczenia na rynku
28000 realizacji

Tworzymy firmę budowaną na uczciwości i wzajemnym zaufaniu, w której to pracownicy odgrywają kluczową rolę. Każdy z nas jest specjalistą w swoim zakresie. Ciągły rozwój i wieloletnie doświadczenie w produkcjach zostały zauważone i zaowocowały realizacją dużych projektów dla największych sieci handlowych.",1992,https://zenprospect-production.s3.amazonaws.com/uploads/pictures/66ee9cf702303e000155422a/picture,,,,,,,,
DABEW,DABEW,Cold,"lista firm Expo PL bez MTP, Firmy EXPO PL - 6.11.25",5,retail,bartosz.kosiba@kreativia.pl,http://www.dabew.com.pl,http://www.linkedin.com/company/dabew,,,23 Swiatkowo,Bytow,Pomeranian Voivodeship,Poland,77-100,"23 Swiatkowo, Bytow, Pomeranian Voivodeship, Poland, 77-100","wyposazenie sklepow i hipermarketow, ciecie laserowe, spawanie tig, mig, malowanie proszkowe, giecie elementow metalowych cnc, wykrawanie, konfekcjonowanie, spawanie laserowe, retail office equipment, medical equipment, precision metal cutting, metal assembly services, laser cutting services, customer service, retail, services, construction, powder coating, all other fabricated metal product manufacturing, ekspozytory metalowe, metal processing, metal hooks, eco-friendly manufacturing, metal parts production, metal shelving systems, custom industrial furniture, certified iso 9001:2015, wykrawanie cnc, metal racks, iso 14001:2015, meble na zamówienie dla biznesu, distribution, cięcie laserowe, industrial metal fabrication, b2b, metal finishing, metalowe meble sklepowe, metal shelving, metal manufacturing, electronics, metal prototyping, manufacturing, metal display stands, spawanie laserowe tig/mig, cnc machining, metal furniture, advanced laser technology, metal structures, metal design, metal display solutions, bespoke metal furniture, laser welding, metal assembly, regały sklepowe, custom metal furniture, wieszaki, haki, zawieszki, transport, retail store fixtures, metal components, stojaki reklamowe, cnc punching, computer hardware, hardware, mechanical or industrial engineering, machinery",+48 59 822 22 85,"Facebook Widget, WordPress.org, Facebook Login (Connect), Facebook Custom Audiences, Nginx, Mobile Friendly, Google Tag Manager, Google Font API",,,,,,,68ed26219678090001e72841,3499,33299,"DABEW jest firmą produkcyjną specjalizującą się w produkcji systemów wyposażenia sklepów i hipermarketów.

Wieloletnie doświadczenie pozwala nam tworzyć produkty, z których jesteśmy dumni. Stawiamy jednak na rozwój, inwestycje w nowe maszyny i technologie. Poszerzamy wiedzę, aby z dnia na dzień się doskonalić.

Zatrudniamy ekipę specjalistów, którzy codziennie dbają o najwyższą jakość naszych produktów.

DABEW to doświadczenie, któremu możesz zaufać!",1986,https://zenprospect-production.s3.amazonaws.com/uploads/pictures/6901c9c67031e60001fcfd67/picture,,,,,,,,
MAESTRA,MAESTRA,Cold,,1100,retail,bartosz.kosiba@kreativia.pl,http://www.maestra.eu,http://www.linkedin.com/company/maestra,,,,Warsaw,Masovian Voivodeship,Poland,,"Warsaw, Masovian Voivodeship, Poland","retail office equipment, whispered interpreting, interpretation in engineering and medicine, conference equipment rental, event services, multilingual interpretation, interpretation technical support, professional interpreters, services, interpretation for international events, event interpretation, de liaison interpretation, conference interpreting, interpretation for official speeches, interpretation rental, interpretation project management, interpretation team, interpretation confidentiality, interpretation for meetings, interpretation booths, interpretation in multiple languages, interpretation in demanding fields, simultaneous interpreting, interpretation services, whispered interpretation, consecutive translation, interpretation and translation services, interpretation equipment rental, interpretation in business, interpretation for conferences in multiple cities, government, long-term interpretation cooperation, conference organization, interpretation for short speeches, interpretation in poland, interpretation in sciences, b2b, interpretation equipment, consecutive interpreting, chuchotage, multilingual services, event management, interpretation training, simultaneous translation, translation and interpretation services, interpretation setup, events services",+48 22 216 54 09,"Google Analytics, Remote",,,,,,,69106df5b504cb00017be99f,,54193,"Maestra Group is an award-winning event design and technical production company with offices in London and Dubai. They specialize in providing comprehensive live event solutions, including audio, lighting, video, and creative content. Their services encompass bespoke video content, graphics, artwork, 3D renders, and turnkey event production. Maestra Group has experience with high-profile events, including The Grammy Awards and The Brits Awards afterparties.

The other Maestra is a marketing technology company that offers an all-in-one platform tailored for Direct-to-Consumer (DTC) brands. This platform integrates customer data collection and communication tools, enabling marketing automation and growth acceleration. They provide services such as marketing strategy, data migration, flow and automation setup, A/B testing, and customer success management. Maestra supports DTC brands in enhancing customer engagement and improving ROI.",,https://zenprospect-production.s3.amazonaws.com/uploads/pictures/66e3d59de20ea00001edf7c8/picture,,,,,,,,
