SHOP DENT,SHOP DENT,Cold,,39,retail,bartosz.kosiba@kreativia.pl,http://www.shop-dent.pl,http://www.linkedin.com/company/shop-dent,https://www.facebook.com/ShopDent.Polska/,,12 ulica Dziupli,Warszawa,woj. mazowieckie,Poland,02-454,"12 ulica Dziupli, Warszawa, woj. mazowieckie, Poland, 02-454","dental product industry, dental product brands, dental product warranty services, dental tools, oral health, dental product reviews, children's dental care, dental hygiene tips, dental hygiene for periodontal disease, dental hygiene for bad breath, dental accessories, dental product quality, manufacturing, professional dental tools, dental hygiene for dental implants, tooth whitening products, oral care, sonic toothbrushes, ultrasonic toothbrushes, dental product retail, water flossers, dental product trends, dental equipment, orthodontic toothbrushes, b2c, electric toothbrushes, dental hygiene for whitening, dental hygiene for dental surgery, dental product warranty, orthodontic care, e-commerce, dental product distribution, dental hygiene for tartar control, dental hygiene store, dental product safety, dental implants, dental product wholesale, d2c, dental hygiene for sensitive teeth, health care and social assistance, dental supplies online, toothbrushes, dental product promotion, dental hygiene, children's toothbrushes, sonic toothbrushes for kids, interdental cleaners, toothpaste, dental product market, dental hygiene for plaque removal, dental product sale, dental hygiene for children, dental product distribution channels, dental hygiene products, healthcare, dental products, dental supplies, dental product delivery, electric toothbrush technology, dental hygiene for adults, toothbrush replacement heads, dental hygiene for braces, dental product support, sonic cleaning, dental product online store, irrigators, magnetic toothbrushes, dental product certification, dental health, dental hygiene for orthodontics, dental health products, dental care shop, professional dental products, wholesale trade, dental market, dental hygiene for gum health, medical equipment and supplies manufacturing, dental care accessories, dental product innovation, dental product marketing, dental product technology, retail, manual toothbrushes, dental product discounts, dental hygiene for implants, oral hygiene products, dental hygiene for seniors, dental products poland, dental product customer service, dental product maintenance, dental product sales channels, dental care, retail trade, dental product accessories, b2b, wholesale, dental, oral_care, sonic_technology, ultrasonic, orthodontic, children, professional, brand_offerings, product_range, delivery_services, discount_offers, customer_support, mechanical or industrial engineering, consumer internet, consumers, internet, information technology & services, health care, health, wellness & fitness, hospital & health care",+48 22 112 38 38,"Gmail, Google Apps, Mobile Friendly, reCAPTCHA, Facebook Custom Audiences, Yandex Metrica, Google AdWords Conversion, Linkedin Marketing Solutions, DoubleClick Conversion, SALESmanago, Criteo, Braintree, Apple Pay, Facebook Login (Connect), Google Maps (Non Paid Users), YouTube, Paypal, DoubleClick, Google Maps, Google Tag Manager, Klaviyo, Hotjar, Facebook Widget, Nginx, Google Font API, Google Analytics, Google Dynamic Remarketing",,,,,,,6868f0c9f7992c0001b00c0f,5044,33911,"Nasza firma powstała w 2007 roku rozpoczynając sprzedaż na platformie handlowej allegro. Niewiele później założyliśmy sklep internetowy shop-dent.pl. Od samego początku istnienia głównym założeniem naszej firmy był najwyższy standard obsługi klienta oraz konkurencyjna polityka cenowa. Wybór wartości, którymi kierujemy się do dziś okazał się strzałem w dziesiątkę. Zaufało nam już ponad 275 tysięcy klientów, za co serdecznie dziękujemy.",2007,https://zenprospect-production.s3.amazonaws.com/uploads/pictures/66e737d5ce2d350001c2b8d1/picture,,,,,,,,
VKF Spork Heinz Renzel Sp. z o.o.,VKF Spork Heinz Renzel Sp. z o.o,Cold,"lista firm jak Vivenge PL, lista firm Expo PL bez MTP, Firmy EXPO PL - 6.11.25",50,retail,bartosz.kosiba@kreativia.pl,http://www.vkf-renzel.pl,http://www.linkedin.com/company/vkf-spork-heinz-renzel-sp.-z-o.o.,,,25 ulica Objazdowa,,Greater Poland Voivodeship,Poland,62-500,"25 ulica Objazdowa, Greater Poland Voivodeship, Poland, 62-500","promocja sprzedazy, druk, ekstruzja, tworzenie od podstaw, ekspozytory, produkcja, montaz, termoformowanie, retail office equipment, systemy do organizacji przestrzeni produkcyjnej, systemy do prezentacji towarów, profile konstrukcyjne z tworzyw sztucznych, exhibition systems, systemy paneli cienkich, artykuły promocyjne, distribution, akcesoria do prezentacji, systemy do magazynowania i logistyki, construction, reklama zewnętrzna, promotional articles, systemy do reklamy zewnętrznej, systemy do reklamy outdoor, profile pvc simple, profile pvc, services, systemy do wyświetlania cyfrowego, pos systems, waste management, systemy do wyświetlania led, systemy paneli perforowanych, systemy do wyświetlaczy led, profile pvc quattro, systemy do oznaczania cen, b2b, systemy oznaczeń cen, reklama cyfrowa, systemy flexislot, retail, systemy do targów i eventów, systemy pos, systemy ekspozycyjne, systemy do organizacji przestrzeni, systemy do reklamy cyfrowej, systemy do wyświetlania informacji, sign manufacturing, systemy do promocji w sklepach, systemy modularne, systemy regałowe, project management, systemy do produkcji i prototypowania, manufacturing, systemy do oznaczeń z tworzyw sztucznych, e-commerce, systemy podświetlane led, systemy oznaczeń, systemy do wyświetlania, advertising and marketing, systemy banerowe, non-profit, productivity, mechanical or industrial engineering, consumer internet, consumers, internet, information technology & services, nonprofit organization management",+48 51 176 49 30,"Vimeo, Mobile Friendly, Google Tag Manager, AI",,,,,,,687582e18ab78f00017ccc37,3999,33995,"Specjalizujemy się w wyposażaniu sklepów i promocji sprzedaży, oferując wszystko, co pomaga sprzedać towar i usługi. Naszym celem jest wspieranie Państwa działalności handlowej. Oferujemy produkty pozwalające wyeksponować towar oraz ułatwiające komunikację z klientem w punktach handlowych. Udało nam się stworzyć na przestrzeni lat największą na rynku ofertę produktów wspierających sprzedaż. Oprócz standardowej oferty zawartej w katalogu proponujemy również rozwiązania ekspozycyjne, informacyjne, reklamowe projektowane na indywidualne potrzeby naszych klientów.",1994,https://zenprospect-production.s3.amazonaws.com/uploads/pictures/6714aeee10a76200010bf663/picture,VKF Renzel România (vkf-renzel.ro),,,,,,,
9design,9design,Cold,Firmy EXPO PL - 6.11.25,36,retail,bartosz.kosiba@kreativia.pl,http://www.9design.pl,http://www.linkedin.com/company/9design-pl,https://www.facebook.com/9designPL,https://twitter.com/9designwarszawa,25 ulica Lucerny,Warszawa,woj. mazowieckie,Poland,04-687,"25 ulica Lucerny, Warszawa, woj. mazowieckie, Poland, 04-687","home and office furniture, interior design trend consulting, furniture for public spaces, furniture for public and private spaces, visualization and 3d modeling for interiors, custom furniture, interior design for commercial spaces, customized furniture, garden furniture, interior project support, interior design training and webinars, exclusive furniture, interior design consultancy, luxury lighting solutions, b2c, trendsetting products, furniture customization services, interior design services, custom interior furniture, mirrors and decorative accessories, showroom warsaw, home decor, furniture and lighting brands, designer furniture, furniture for living and dining, designer lighting, b2b, interior design project management, furniture showroom warsaw, interior design for hotels and restaurants, customer service, designer home decor, interior styling workshops, garden furniture and accessories, custom furniture for apartments, lighting design, interior design trends, visualization services for interiors, e-commerce, custom interior solutions, interior decoration accessories, home accessories, interior design project support, interior design, luxury furniture, garden and outdoor furniture, furniture, high-quality brands, interior decoration, interior design accessories, luxury garden furniture, architectural interior support, custom furniture production, textiles, interior styling and arrangement, interior styling services, d2c, interior design consultation, lighting fixtures, interior project management, interior styling, designer lamps, fragrances, designer furniture collection, custom furniture manufacturing, interior design support for professionals, modern lighting, architect collaboration, designer furniture for public spaces, designer furniture collaborations, interior design collaboration platform, interior decoration textiles, interior accessories, luxury interior furnishings, architects and designers support, personalized furniture design, interior personalization, interior design workshops, designer lamps and lighting, lighting, services, interior decoration accessories for professionals, decorative mirrors, interior design solutions, interior decoration for commercial projects, furniture retail, retail, designer furniture warsaw, interior_design, luxury_furniture, custom_furniture, interior_consulting, architect_collaboration, showroom, interior_styling, designer_brands, interior_projects, furniture_for_public_spaces, interior_decor, interior_trends, professional_support, consumer internet, consumers, internet, information technology & services",+48 22 113 99 99,"Gmail, Google Apps, Google Play, Google Tag Manager, Bing Ads, Linkedin Marketing Solutions, reCAPTCHA, Google Dynamic Remarketing, Google Maps, Facebook Login (Connect), YouTube, Criteo, Nginx, SALESmanago, iTunes, Paypal, Mobile Friendly, DoubleClick Conversion, Adform, Google AdSense, Google AdWords Conversion, Apple Pay, Apache, DoubleClick, Bootstrap Framework, Facebook Widget, Google Analytics, Facebook Custom Audiences",,,,,,,690c68ee10b68f00012d22b0,5712,,"9design is a Warsaw-based company that specializes in modern contemporary furniture and interior design accessories. Their showroom features a curated selection of designer furniture, lamps, mirrors, and decorative items, all aimed at enhancing both residential and commercial spaces.

In addition to retail, 9design collaborates with architects and interior designers across Poland, providing tailored services to support professional partnerships. This approach allows them to integrate their products into larger design projects, making them a valuable resource for design professionals.",,https://zenprospect-production.s3.amazonaws.com/uploads/pictures/68bbf73d058f760001dd5a7a/picture,,,,,,,,
LEMI,LEMI,Cold,,15,retail,bartosz.kosiba@kreativia.pl,http://www.lemi.com.pl,http://www.linkedin.com/company/lemi,,,,Lodz,Lodz Voivodeship,Poland,90-132,"Lodz, Lodz Voivodeship, Poland, 90-132","retail office equipment, online store, office supplies, art materials, international logistics, artistic tools, luxury office supplies, trade shows, unique design products, audiovisual accessories, online sales, customized it solutions, inventory management, product distribution, warehouse logistics, market expansion, premium stationery, distribution, specialized office furniture, b2b sales, home furnishing merchant wholesalers, warehousing, warehouse, b2b, office equipment, e-commerce, product import, international trade, art supplies, customized solutions, warehouse management, product customization, designer office supplies, it implementation, office products, artistic equipment, luxury packaging, poland, polish craftsmanship, artistic branding, import-export, import export, product export, office stationery, product import-export, custom stationery, exclusive distribution, logistics, wholesale trade, brand partnerships, specialized art materials, specialty markers, product sourcing, it systems, global trade, art gallery supplies, exhibition supplies, trade fairs, trade fair participation, custom art products, distributor, trade show exhibitions, polish artisans, product distribution network, retail, international partnerships, artistic materials, retail distribution, stationery, premium art supplies, art products, artistic design, services, supply chain management, logistics services, transportation & logistics, consumer internet, consumers, internet, information technology & services, logistics & supply chain",,"Gmail, Google Apps, Bootstrap Framework, Mobile Friendly, Google Font API, Remote",,,,,,,69106df4b504cb00017be90f,5099,42322,www.lemi.com.pl,1990,https://zenprospect-production.s3.amazonaws.com/uploads/pictures/6706408f49c4fc0001c11a52/picture,,,,,,,,
Dino Product,Dino Product,Cold,,1,retail,bartosz.kosiba@kreativia.pl,http://www.dino-product.com,http://www.linkedin.com/company/dino-product,,,49 ulica Jana Kilinskiego,Ostrowiec,Swietokrzyskie Voivodeship,Poland,27-400,"49 ulica Jana Kilinskiego, Ostrowiec, Swietokrzyskie Voivodeship, Poland, 27-400","interior design, life size figures, art & crafts, theme parks, sculptures, models, retail art supplies",,,,,,,,,69106df9b504cb00017bedbc,,,"Meet Dino Product – who we are?

We are a group of businessmen, scientists, qualified artists (sculptors, paleoartists) and craftsmen. 

By combining the knowledge of our experts - since 2008 as Dino Product - we have been making and delivering very professional products: lifesize statues/models of dinosaurus for theme parks, human figures, other models for movie productions, advertising, dioramas for museums and special realisations for individual clients and needs. 
You can meet our works in Poland, France, Germany and soon in United States (Moab, Utah) on international tradeshows, great events and picnics in whole Europe. 

Our works and expierence - What we do? 
6 years of experience succesfully completed on polish and international market
We make and deliver figures/models/sculptures for outdoor and indoor use:
Lifesize scupltures, models, figures – human and animal figures for theme parks, dinosaur statues (our flagships products), sea creatures, special models for movie productions, tradeshows, exhibitons and individual orders – over 500 pieces lifesize models/figures for network theme parks in Poland and abroad. 
Arrangements of the theme parks, museums, restaurants – interior desing
We build and design – theme parks, museums, dioramas, restaurants
Individual orders – ask what you need – we will answer every typical and unthypicall question.

Everything starts with an idea - How do we work?
Our designs are made with exceptional precision, with attention to detail in consultation with scientists at every stage of production. 

Our products has a high resistance to weather conditions - our statues and figures of dinosaurs/humans/animals/creatures stand in the heat and snow. Material we use in our work: styrofoam, silicon, resin, fiber-glass, plasticine.",2008,https://zenprospect-production.s3.amazonaws.com/uploads/pictures/66e800bd587fa4000154b902/picture,,,,,,,,
Kwiaty dla Biura,Kwiaty dla Biura,Cold,,19,retail,bartosz.kosiba@kreativia.pl,http://www.kwiatydlabiura.pl,http://www.linkedin.com/company/kwiaty-dla-biura,https://www.facebook.com/kwiatydlabiura/,,6 ulica Karkonoska,Warszawa,woj. mazowieckie,Poland,03-602,"6 ulica Karkonoska, Warszawa, woj. mazowieckie, Poland, 03-602","tereny zielone, eventy, pielegnacja kwiatow, kwiaty ciete, kwiaty i rosliny doniczkowe, wynajem kwiatow i donic, sprzedaz donic, swieta, retail office equipment, event planning and services, services, rośliny do ciemnych pomieszczeń, ekologiczne nawozy, zielone instalacje artystyczne, zrównoważony rozwój, design and interior decoration, warsztaty roślinne, biophilic design, zielone ściany, consulting, zielone ściany z mchu, zielenie na eventy, kompozycje roślinne, serwis roślin, rośliny biurowe, zielone wnętrza, dekoracje roślinne, miniaturowe lasy w biurze, zielony design, systemy wertykalne, rośliny oczyszczające zanieczyszczenia, zielone dekoracje na święta, zazielenianie przestrzeni, zielenie w strategii esg, rośliny oczyszczające powietrze, kompozycje kwiatowe, rośliny doniczkowe, facility management, rośliny do przestrzeni zamkniętych, environmental consulting, pionowe ogrody, wieszane rośliny, projektowanie przestrzeni, ekologiczne dekoracje, zielone obrazy, facilities services, donice samonawadniające, landscaping services, rośliny kolekcjonerskie, zielenie w przestrzeniach publicznych, zielenie biur, zielone aranżacje, b2b, zielone regały, projektowanie zieleni, mech stabilizowany, e-commerce, finance, distribution, construction, consumer internet, consumers, internet, information technology & services, financial services",+48 69 458 18 65,"Google Tag Manager, Apache, Bootstrap Framework, Mobile Friendly, Android, React Native",,,,,,,69106df9b504cb00017beddc,,56173,"Ubieramy biura w kwiaty kompleksowo i kreatywnie.

Wierzymy bowiem, że biuro, w którym upływa nam większa część dnia, powinno być nie tylko przestrzenią służąca do pracy, lecz także miejscem, w którym spędza się czas z przyjemnością i wraca do niego z uśmiechem.

Kwiaty mają taką moc...",2008,https://zenprospect-production.s3.amazonaws.com/uploads/pictures/6714f0746727100001428b9c/picture,,,,,,,,
ASAL Studio,ASAL Studio,Cold,,4,retail,bartosz.kosiba@kreativia.pl,http://www.adasokol.com,http://www.linkedin.com/company/asalstudio,,,,Warsaw,Masovian Voivodeship,Poland,,"Warsaw, Masovian Voivodeship, Poland","retail art supplies, digital ecosystems, eco-friendly web design, digital art, art and design, low-emission websites, hyper-realistic visuals, environmentally conscious design, sustainable technology, digital ecology, digital sustainability practices, collaborations with luxury brands, 3d art, art exhibitions worldwide, nature-inspired design, sustainable digital art, jewelry and silverware manufacturing, b2b, education",,"Gmail, Google Apps",,,,,,,69106e15b504cb00017c0633,7299,33991,"ASAL is a studio created in the Fall of 2022 by a Polish 3d artist and designer – Ada Sokół. For several years she was building her experience and unique style of hyper-realistic, ethereal visuals that are easily recognizable and sought after by both commercial clients and art events. By highlighting opposite ends of the spectrum and exploring her fascination with nature and technology, she developed a distinctive style and sensibility that makes her stand out among other creators.

Creating the ASAL Studio was a budding idea for years. And finally, we took a leap of faith in making this dream come true. A dream of not only gathering a team of like-minded, art-focused individuals striving to develop breathtaking visuals and starting environmentally conscious practice. As much as the current society lets us, we wish to change the beaten trail and alter the process of how digital art is created.",,https://zenprospect-production.s3.amazonaws.com/uploads/pictures/66e9336b4145ce00015c5c85/picture,,,,,,,,
Lunares.pl,Lunares.pl,Cold,,5,retail,bartosz.kosiba@kreativia.pl,http://www.lunares.pl,http://www.linkedin.com/company/lunares-pl,https://www.facebook.com/lunarespl/,,,Krakow,Lesser Poland Voivodeship,Poland,30,"Krakow, Lesser Poland Voivodeship, Poland, 30","architectural lighting, oświetlenie ogrodowe, industrial lighting, led downlights, lampy sufitowe, led track lighting, led medical lighting, kinkiety, led ceiling lights, led grow lights, lighting, led stage lighting, e-commerce, b2c, led custom lighting, lampy glamour, led floodlights, led pool lighting, led pendant lights, oświetlenie do domu, led furniture lighting, led ceiling panels, led smart lighting, led garden lights, lampy do salonu, led strip profiles, commercial lighting, lampy do sypialni, led strips, led floodlight with sensor, led bedside lamps, interior lighting, led office lighting, led cove lighting, nowoczesne lampy, lampy do łazienki, lampy industrialne, led horticultural lighting, led dimmable lights, oświetlenie techniczne, led linear lighting, led stair lighting, led energy-saving lamps, profile led, lampy dekoracyjne, led profiles, smart home lighting, electric lighting equipment manufacturing, led spotlights, led wall lights, led architectural profiles, interior design, exterior lighting, led decorative lamps, led pixel lighting, lampy minimalistyczne, led emergency lighting, led panel lights, led art lighting, modern lighting, led aquarium lighting, d2c, lampy do biura, oświetlenie led, led kitchen lighting, led controllers, lampy skandynawskie, b2b, led color changing lights, led outdoor lights, led tape, outdoor lighting, led under cabinet lighting, lampy boho, led neon flex, led lighting, led signage lighting, led display lighting, home decor lighting, led veterinary lighting, lampy wiszące, retail, home decor, taśmy led, led bathroom lighting, led, smart home, industrial, modern, architectural, commercial, outdoor, profile, strip, dimming, color changing, custom, neon flex, pixel, linear, cove, under cabinet, stair, floodlight, sensor, emergency, signage, display, stage, art, furniture, aquarium, horticultural, grow, veterinary, medical, consumer internet, consumers, internet, information technology & services, electrical/electronic manufacturing, mechanical or industrial engineering, internet of things",+48 51 557 45 81,"Gmail, Google Apps, New Relic, Google Dynamic Remarketing, DoubleClick, Google AdWords Conversion, Nginx, Google Tag Manager, DoubleClick Conversion, Google Analytics, Mobile Friendly, Remote, AI",,,,,,,69106e18b504cb00017c09a5,3631,3351,"✅ Sprawdź ofertę naszego sklepu oświetleniem i lampami w Krakowie – nowoczesne oświetlenie Twojego domu w atrakcyjnych cenach. Szeroki wybór markowych lamp, kinkietów, żyrandoli. Zapraszamy serdecznie!",2016,https://zenprospect-production.s3.amazonaws.com/uploads/pictures/66f5034bed2db3000165529a/picture,,,,,,,,
Dywany Łuszczów,Dywany Łuszczów,Cold,,11,retail,bartosz.kosiba@kreativia.pl,http://www.dywanyluszczow.eu,http://www.linkedin.com/company/dywany-%c5%82uszcz%c3%b3w,,,73 Luszczow Pierwszy,Wolka,Greater Poland Voivodeship,Poland,20-258,"73 Luszczow Pierwszy, Wolka, Greater Poland Voivodeship, Poland, 20-258","pvc linoleum, custom-made carpets, carpets, anti-slip mats, sisal rugs, outdoor rugs, e-commerce, custom carpets, rugs, traditional carpets, interior design, home decor, b2c, carpet cleaning, carpet store, artificial grass, floor coverings, carpet tiles, carpet accessories, home furnishings, interior accessories, services, online shopping, flooring, hotel carpets, shaggy carpets, carpet accessories for interior design, wall-to-wall carpets for buildings, carpet cutting, wall-to-wall carpets, runner carpets, d2c, restaurant carpets, retail, modern carpets, consumer internet, consumers, internet, information technology & services",+48 81 751 26 34,"Rackspace MailGun, Gmail, Google Apps, Criteo, Bootstrap Framework, Mobile Friendly, YouTube, Facebook Widget, Google Analytics, Google Dynamic Remarketing, Facebook Login (Connect), Facebook Custom Audiences, Apache, Google Font API, Google Tag Manager, Webmail, Mirakl, Hubspot",,,,,,,69106e18b504cb00017c09b6,5713,,"Firma DYWANY ŁUSZCZÓW istnieje od 1995 roku. Oferujemy dywany, wykładziny, chodniki i artykuły do wnętrz w różnych kolorach i wzorach. Początkowo głównym profilem działalności był import dywanów oraz sprzedaż hurtowa na rynku krajowym. Z biegiem lat rozwinęliśmy również sieć sprzedaży detalicznej prowadzonej w ramach własnych sklepów.",1995,https://zenprospect-production.s3.amazonaws.com/uploads/pictures/67142ff9475e690001cca15c/picture,,,,,,,,
